桃红又见一年春 带你探寻广西的十里桃林,“桃之夭夭， 灼灼其华”，初春，纷繁的桃花在晨光中开得格外喧闹，密密层层，宛如一片朝霞，繁如群星的花蕾随着枝条在春风里欢快地摇曳着，那片片桃林仿佛成了红雨纷扬的世界，不知不觉，也成了桃花的海洋，今天就跟着小浪一起去探寻的十里桃林吧~恭城西岭乡桂林恭城的桃林不仅花朵繁茂，而且气势磅礴。红粉菲菲的桃花，沾带晨露，漫山遍野地绽放，染红了大岭山，这是恭城最美丽的季节，桂林恭城桃花节就在这片粉红色的天堂中举行。届时，美丽的瑶族少女将在桃花树下随歌起舞，春风弄忮头，人面桃花相映红。灵川海洋乡桃花开放的季节，海洋乡的每一个村寨，都是一片片灿若朝霞的桃花。一簇簇粉红色的桃花，如云似霞、满树烂漫，向我们展示着优美的姿态。深深浅浅的点点红色，明亮了海洋的春，嫣然浅笑的花朵，流溢着醉人的芬芳。环江八戒山随着天气回暖，环江八戒山公园中漫山遍野的桃花争相怒放，大朵大朵的桃花层层叠叠开满一树，空气中处处弥漫着桃花的清香。桃花美景引来了众多游客走进花海里，感受这盎然的春意。南宁青秀山青秀山的桃花品种繁多，毛桃、碧桃、人面桃、日月桃、寿星桃。。。。。这些可爱的精灵娇俏地立在枝头争奇斗艳，令人心醉。每到春暖花开时节，12万株桃花争相吐艳，灿若红云。踏春游人漫步于桃花林，祈求幸福好运、吉祥如意。南宁花花大世界花花大世界是典型的喀斯特地貌，在这里既可以和美轮美奂的桃花合影留念，也可以漫步在青山绿水间，放松疲惫的身心，畅享大自然的纯粹。可谓是，春风乍起，吹皱湖水，湖边有香尘十里，盛世桃花。龙潭公园的桃园人气每年都很旺，虽无的清净，但姹紫嫣红、密密层层，宛如一片朝霞的桃花，也不枉数万人追逐。一朵朵，一簇簇粉色的、红色的花朵竞相绽放，承包了整片芬芳。
九华山什么季节最美 师傅说是当下,经常会有人问工作人员：什么季节最美？刚开始有人问及，他们会从历史、佛教文化、人文风貌以及四季交替之美详细介绍。直到有一天，从无门慧开禅师所作的 “春有百花秋有月，夏有凉风冬有雪。若无闲事挂心头，便是人间好时节”诗偈之中得到启悟，每个季节都是大自然的美丽馈赠，最美景色就在当下。何尝不是，四时之幻化，只要用心感受，便是最美之季。大雪过后，雾凇、冰挂、云海、日出、佛光等奇异风光和景象纷纷呈现，尽显莲花佛国之美。云海下的金黄庙宇、层层山峦，相映成趣，勾勒出九华山独有的韵味和浪漫。站在群山之巅，聆听袅袅佛音，伴着晨钟暮鼓，去探究和追寻莲花佛国的神奇魅力，感悟人生之真谛。风雨送春归，飞雪迎春到。蜡梅也赶来赴那冬天的约会，独秀芬芳寒冬中，一枝独秀千姿态。佛曰遇见即是最美，安住当下，与自己同在，遵从于内心，遇见自己最美的季节。摄影：左剑中、杨银龙、杨洪轩、叶子春、李春内容来源：九华旅游603199 李春
趟过山歌的海洋 探寻刘三姐故里宜州,刘三姐于，已然成为了一个符号，一个神话；她是山歌的仙，她是自由的化身。那你们可知刘三姐故里位于我们的，这里有雄奇瑰丽的山水，古朴多彩的风情，婉转动听的山歌，这里是天下民歌最眷恋的地方。今天就让我们一起走近刘三姐故里――。下枧河下枧河是到达刘三姐故居的必经之地，河水碧绿，清澈透底，放眼望去，两岸翠柳依依，招手相迎；两岸多为风化石和层叠石，仿若“水上石林”，让人尽情观赏。河湾水面宽阔，夹有平坦狭长的沙洲，游人可撑排泛舟，拾级探胜，绿洲寻趣。流河寨流河寨中至今仍保留有刘三姐、阿牛哥、王媒婆当年居住过的房屋，寨内林茂成荫，鸟语花香，寨中有数棵百年龙眼古树，最吸引人的莫过于亲自参加对山歌和民族表演，将你带回到了当年刘三姐和阿牛哥生活的年代，让你远离城市的喧嚣，尽情享受这恬静与悠闲。壮古佬景区壮古佬景区前襟碧玉青罗般的下枧河，后依古木葱笼的马山。沿环山步道拾级而上，登高望远，村寨、农舍、田庄、青峰、碧涧、流岚佳境俱全，可以将宛若仙境的下涧河风光尽收眼底！龙洲岛龙洲岛是一个生态田园休闲旅游度假区，岛屿两旁绿竹柳垂，岛内绿树成荫。在这里你可以抛却城市的喧嚣，投入田园牧歌的生活。置身龙洲岛，朝霞夕阳与鸟叫蝉鸣陪伴你，尽享大地原野芬芳。会仙山会仙山景区位于宜州市城北会仙山一带。会仙山之名来源于传说古时曾有仙人跨鹤来此山上集会。唐代陆禹臣曾在此山修炼，最后羽化飞升，后人遂称他为陆仙翁，并慕名纷至踏来于此寻仙访胜，遂成游览胜地。西竺寺远眺宜州市东北方的一座青山，有朝云晨雾缭绕弥漫于其腰下，其顶则有一亭若殿飘浮半空，恍若仙境，这就是西竺寺。这里环境清幽、常年香火不断，来到这里，仿佛进入一个清凉的人间佛国，令人心灵平静，烦恼渐消。
火祝夯罩萑司晒庖趵镒钆冬的器物,作者： 朱国平人，高级企业文化师，中国摄影著作权协会会员，省作家协会会员，省摄影家协会会员，黄山市摄影家协会理事，黄山市徽州摄影家协会副主席，黄山永佳（集团）有限公司《今日永佳》主编。全文摄影：杨帆地处皖南的徽州，四季可以用尺子来量，节气都是压着点的。每年的冬至进九，自然就到了冻手冻脚的季节。从这时到来年的开春，徽州乡村随处可见一种取暖的工具―“火住薄Ｔ诨罩荩即便是数九寒冬，零下气温的日子并不多。但我听说有些长期生活在北方的人来徽州都扛不住这里的寒，因为北方的乡村有炕，屋里烧着取暖的柴禾，城里有暖气，只要不出门，就不觉得冷，可是徽州没有。徽州的乡村，无论冷热都没处躲、没处藏，外边热就到屋子里凉快凉快，屋里冷就到外边的阳光底下暖和暖和。所以，徽州人是最知冷暖的。“火住笔腔罩萑擞美春媸帧⑴脚的御寒用具，也是徽州民间自古以来就有的物件。徽州火追治两部分，外观是用竹篾编成，内空外圆，上面有竹片编制成的拎把；内空用来安放火钵。火妆┞对谕獾脑部诙寂溆谐叽缦嗟钡耐状火赘牵一般是用铜丝或铅丝编成；火装咽值囊徊喽寂溆幸凰铜制或铁质的像筷子一样的“火左纭保镶插在火装焉稀Ｈ∨的时候感到火力不够时，就手取下“火左纭保沿火钵四周松一松炭灰，这时，炭灰上面便会裂开一道道缝，那焐在下面的炭火就露一道道通红的亮光，火力顿时又上来了。火姿用的炭大多是农家自己做饭烧菜时未燃烬就退出来的柴炭。火子玫纳系忍渴巧讲枳芽巧粘傻奶浚结实耐用，保暖时间长，可以从早用到晚。在乡下，妇女们串门时，围裙下面一定是罩着一只火祝欢日的阳光下，乡邻们把火琢在膝头，边取暖边家长里短。在徽州，“火住笔潜还惴菏褂玫模每家每户都有，人们除了用来焐手焙脚取暖，也用它来烘烤衣服、保温饭菜。徽州民间的婚、丧大事中，火滓彩潜夭豢缮倨骶摺Ｓ亲嫁娶，嫁妆中一定会有一对贴上了红喜字的精致火祝寓示香火绵延。“火住苯我的童年暖暖地、暖暖地焐在记忆深处。
一分门票不花，游遍杭州最不能错过的文艺复古拍照圣地,Day11、吃饭住宿――翁家山2、徒步赏景――3、活化石――浙大之江校区（一定要去）4、吃饭住宿――丝联166文创园Day25、干呆着――富义仓创意空间6、干啥都行――大兜路历史文化街区7、没事儿闲逛――小河直街（可以不去）书接上文徒步线路城区轨迹富义仓文化创意产业园游览时间：2016-10-25门票：免费地址：省市霞湾巷8号我们住在大兜路的“我们”民宿，周边可以逛的地方非常多。其中一个就是始建于清光绪年间的国家战略粮食储备仓库富义仓，它与南新仓并称“天下粮仓”。如今，它是现存唯一的古粮仓。几年前一场大火，差点儿使它被推土机铲走。直到2007年，才以原有的占地范围、材料、按历史风貌原汁原味修复。13幢建筑东西相向而建，砖木结构四列三进，白墙黛瓦、石门木窗、马槽水缸……2010年4月它变为了“精神文化粮仓”文化创意园。这里有茶馆、咖啡馆，安安静静，鲜有游人。在院落里逛逛，颇能找到古典诗词里面描绘的庭院深深的感觉。大兜路历史文化街区游览时间：2016-10-24地址：省市拱墅区大兜路价格：免费从富义仓往北走一点点，就到了大兜路历史文化街区，这里至今保留着国家厂丝储备仓库、香积寺石塔、大量清末民初民居建筑，想看老城历史风貌，就来这儿。唯美小茶馆，禅意不过分沿着东岸，鳞次栉比地林立着大大小小的店铺，有着古朴和时尚的韵味，从字体到装潢，都让人看了很舒服。其实国内很多城镇都排列的这很多店铺，但总是看起来不美观，很多原因就在于颜色和字体的选择。再往北走就是厂丝库区，它是在不改变总体环境风貌基础上，改造的电线电缆总厂（原国家厂丝仓库旧址）部分工业建筑，其间入驻了餐厅、酒吧、甜品店、咖啡馆……最有意思的地方当属建于1951年的国家厂丝储备仓库，砖木结构的三层清水砖建筑，现在已经是著名的城市度假精品酒店――运河契弗利酒店Che‘fle。11栋原国家厂丝仓库保留了青砖高墙仓储建筑风格，又在两座建筑间用钢架架起了一个高大的长形穹顶。爱设计酒店的人们，看过必被勾魂摄魄，我属此列。运河畔有长长的步道，市民骑车、休憩、行走。小河直街历史文化街区游览时间：2016-10-25地址：省市拱墅区小河直街51号价格：免费小河直街从宋朝以来就存在并繁盛过，曾是晚清的320国道。现在的街巷是民国时期改建的，还保留着清末民初典型的水乡民居风格一河两街格局，面街的一楼为商铺，二楼为住所，是下店上宅的典型，一大排木结构建筑，狭街窄巷夹于其间。在这儿我邂逅了当年的标杆儿商户“云水谣”。说起来惬意，看起来很美，实际上并不这么然。市井味儿确实挺足，但是卫生死角也比比皆是。所以如果你实在没地儿去，或者顺路经过可以看看，专程来就不必了。理想・丝联166创意产业园游览时间：2016-10-24地址：省市拱墅区金华南路189号价格：免费“杭丝联”即“地方国营丝绸印染联合厂，是周总理亲自批准兴建的万人大厂，由前苏联国家第一设计院专家设计的锯齿形厂房，结束使命后经过艺术家们的改造，成为了著名的LOFT创意产业园。高大空旷的厂房被分割成了一个个独立空间，入驻的商户和工作室不用想也知道会有摄影工作室、服装设计、复古商品、咖啡馆、餐厅等。第一次来丝联是2010年，我们两三个人跟着特爱徒步旅行的同事姐姐来这里的青桃餐厅吃饭过周末。老工厂改建的餐厅出品中餐，旁边挨着的姊妹店蜜桃餐厅做西餐，那时我除了家门口的798，没见过其他旧工厂改造的创意园区，一下子深深爱上这种把不久远但一去不返的历史，一把薅回眼前的空间，好像封建时期的人穿越到今天，脑子虽接不上茬儿，但看着好歹不是古人。6年后，青桃餐厅不复存在，蜜桃居然还坚挺地甜蜜着。巨大的风扇（请问那是鼓风机吗，不懂），老物件，店里的姑娘们都透着特有气质又好看。我和我爸为了今晚能去两家餐厅，只点了一点点，味道已经淡忘，由于食欲浅显，好像没有觉得多么记忆深刻。对我来说，是一个特殊的地方，给了我落差，让我知道自己的怂，和别人的能，遥远的家和心更遥不可及的“家人”也练就了我一副铁石心肠，身边有志同道合的集团其他子公司同事，所以那时候我从不想家。其实除了我的三表姐外，家人朋友没有一个人知道初出茅庐从未背井离乡的大孩子经历过什么，在怎样的天气怎样的时间干着怎样的工作，遇到过什么样的人和命运的作弄与折磨。那年，晚上跟几个老乡徒步去几公里外的餐厅约饭；跟姐们儿在古翠路的世纪联华买大闸蟹，去她家现做先吃，听她说自己不幸的感情和没情商没人性的男友对她的方式……那年，一个体育不及格生遭遇了人生中第一次拓展训练，第一次自己爬上8米高的铁杆，站在还在摇晃的20CM直径的圆盘上，跳出去抓一米五外的铁杠，那一串动作最难的就是怎么从蹲到站起来，记得我是喊着铁木真的名字跳出去的，成功抓到了……这之前，大一军训离营时，我是那么咬牙切齿地解着恨地说：这辈子再也不用军训了！跟我同屋的同事是HR，有一天终于说出了自己的困惑，说没看我穿过牛仔裤，觉得我特个色，另类。那你知道我穿坏过多少条吗，我为什么要别人一样，要像你心中的我一样才算正常，你觉得我正常我才正常？这个人在我心里被划了一个大红叉。那些日子我惨遭非议、算计、冤枉、不公，我永远记得那时帮过我的两个大眼睛的大哥和善良的姐姐，也永远记得另一个大哥的话：职场立足的方式有许多种，做个好人是最失败的一种。在的最后一天，我含着眼泪去找杨馨，把我不带走的生活用品给她，我舍不得她，居然万幸地她没在座位，也就这样避免了一场抱头痛哭……后来她来出差，我会去见她，陪她住酒店，她来面试住在我家。从学生时代的昂首挺胸，到初入职场知道蹲下，而从蹲着到站立的艰辛，只有自己知道。好在都过去了，含泪播种，必欢笑收割。多年后，我是一个游人，带着老家儿的游子，来到这个久负盛名的旅游城市，内心却又好似回到了久别的故乡。作者：那敢情好了探索隐蔽去处 分享小众旅行土著，伪文艺青年，自由摄影撰稿人。假期时间丈量世界，工作间隙写字拍片儿，生命不息，行走不止。未经许可禁止转载或商用
寻美颍上 听一个皖北小县的传说,滔滔淮河谁，依依颍上柳，千古一相管仲故里，道不尽的沧桑与风流。走进颍上，看管子故里，品一座皖北小县的悠悠历史。省颍上县，地处淮河与颍河交汇处，黄淮平原最南端。这里有管子思想流芳千古，更有常任侠、戴厚英、陈国良等当代名流熠熠生辉。淮河水、颍上柳见证了它的风霜与变迁，源远流长的历史文化与独特的自然人文景观让其在整个淮河流域独树一帜。行走在颍上，能清楚的感受到文化的脉搏跳跃在城市的每个角落，生生不息。湖渔丰收时的淮河锣鼓，别有一番情趣，明清苑里的花鼓灯，展现淮河儿女的礼仪风情，民间小调颍上推剧，是乡土里孕育出的一颗明珠。更有流传千年的管子思想，滋润着代代世人。步入到管鲍祠，祠内肃穆而安静，几株翠柏，点缀出几缕生机。管仲墓前高大的石碑上书“呜呼大政治家颍上管仲之墓”几个遒劲有力的大字。驻立片刻，便心生敬意。管鲍祠原名管子祠，始建于何年，已不可考。明万历六年（1578年）重建，明末毁于战火；光六年（1826年）重修。1986年，这里被公布为省级文物保护单位。因同时纪念管仲、鲍叔牙两位颍上先贤，遂改名管鲍祠。管鲍祠很小，且屈居在小城一隅。世人多半并不知道颍上原是管仲的故里，在这个偏北小城里还有这么一位伟大的先贤。相较于闻名的“孔子故里”，“屈原故乡”，突然有点替管仲委屈。但看到不大的祠堂香火鼎盛，颍上建九合塔，办管子学术研讨会、中华祭管大典来祭奠这位伟大的先贤，又有几分欣慰。安居与此，少了岁月的纷争，静看世事变迁，怕也是这位大思想家的心愿，毕竟，历史和人民并没忘记他，这已足够。乘一叶乌蓬，阳光在水里舒展，摇曳的波光，撩开一水粼粼的涟漪。清澈的水，穿越千年的时光，流转着一个又一个的花开岁月，颍上的不是江南却胜似江南。颍上占地面积3600亩，是皖北唯一的一个国家5A级风景区。眼前的美景似乎很难让你联想到从前的洪水泛滥，民不聊生。八里河在近百年来，遭受的灾害是触目惊心的。据《颍上县志》记载：众水所潴，故汪洋浩瀚，其势特大，南北相距八华里许，故曰八里河。在沿河两岸老一辈人的记忆中，八里河的水常年浩渺，一入夏，河水决堤，河床抬高，良田淹没，房屋倒塌，群众被迫外逃求生。直到一九九零年春，八里河痛定思痛，开始建桥筑坝，出动六千多名民工，一千三百辆架车，奋战五十六天，六百多米长的过河大坝和与桥合拢建成。一条巨龙似的大坝横卧八里河，两岸人民欢呼雀跃，从此结束了河难的历史。今天的八里河得到了治理与开发，将水患变水利。河水清澈，鱼质优美，年产百万斤以上。在干旱年景确保了农田用水，内涝时河水可排于颍河，农作物仍可获得收成。颍上更是依托八里河自然风光全力打造生态旅游业。而八里河是当地农民一砖一石，一花一木亲自打造出来的公园，风光秀丽、景色迷人。漫步其间，淳朴的田园风情扑面而来，纯生态的美景加纯生态的匠心才会让人生出返璞归真之意。在颍上，不仅有八里河，与之相映成趣的还有迪沟生态旅游区以及五里湖生态湿地。它们都是依水而存，以水而生。寻一条水带渐入佳境，湖畔园林石径、高大景观树阵、错落的长青灌木、别致的人工岛屿、滨水木栈道……仿佛走进了一幅风光旖旎、美不胜收的画卷。（ 文源：摘自《旅游世界》7月刊 ）
广西雪景分外娇 踏雪何须到北国,当烟雨的精魂，在恋恋不舍中化为朵朵晶莹的雪花飞舞，又该是怎样一种动人心魄的美？其实冬天在我们西南地区高山地带也能看见雪，群山之间，一片白茫茫，再无其他的杂色。趁着寒流来袭，小编就要带着大家来欣赏一下的最美雪景~贺州姑婆山当贺城还是一派暖日繁花的时候，隐居的姑婆山却迎来了专属于她的贵客――南国白雪。天地间一片静谧，漫天飞舞的雪花给姑婆山增添了别样的魅力，雪精灵轻轻地踮起细细的脚尖，欢快地旋转着，瞬间遍及姑婆山的每一个角落。大明山因其特殊的地理位置，每当冬季山下阴雨天气，山上就会雪花飘舞，银装素裹。冰雪雾凇是大明山四季景观一绝，每当大明山上温度降至零度以下并伴有雨雾天气，就有可能出现雾凇。如果遇上出太阳，冰凌、冰挂与暖阳交相辉映，那简直美不胜收。天湖天湖距桂林市县城49公里，这里有杭州西湖“浓妆淡抹总相宜”的湖光山色，也有洞庭湖“茫茫五百雪域”美称，是观雪的理想胜地。冬天到天湖赏雪，有山有水有雾海，一次可以领略多种风情。梯田冬季，雪把梯田和山寨都嵌入了冰雕玉砌的童话世界里。冬日的龙脊，从流水湍急的河谷，到白云缭绕的山巅，厚厚的积雪都伏贴着层层的梯田，美不胜收。偶尔飘来的一两片云雾，让你不知置身何处，有一种飘渺、超脱的感觉，宛若一幅古朴而壮丽的田园雪景画。隘门界连日低温天气使县隘门界出现了雾凇美景。雾凇虽然没有降雪那么“壮观”，但树枝、小草上都挂着亮晶晶的雾凇，也是冬天别致的美景。山上的雾凇如盎然怒放的花儿，被当地的摄友称为“冰花”。有道是：雪景分外娇，踏雪何须到北国。
