美图安庆 天柱一峰擎日月,安庆有山名“天柱”，雄伟挺拔，“天柱一峰擎日月”；安庆有水名“花亭”，朝晖夕照，“千重山色，万顷波光”；安庆有城名“安庆”，大观远眺，塔影横江，“此地宜城”。环此山水城，潜岳山区的司空、妙道、明堂等诸山，武昌、菜子、石门、嬉子等诸水，以及流经境内的潜水、皖江，再加上南国小长城白崖寨、长江绝岛小孤山、古火山遗迹浮山、万里长江第一振风塔，包括陈独秀陵园、桐城文庙、孔城古镇，等等，构成富有浓烈地域色彩的“皖风皖韵”景观。世界地质公园天柱山，主峰1488.4米，为江淮地区最高山峰。一峰擎日月，千仞锁云雷。汉武帝封此为南岳。山腹炼丹湖，波光山影，幽明幻变，传说左慈炼丹处。文化两翼：一为佛，二为道。天柱峰，又名笋子尖，海拔1488.4米，为江淮地区最高山峰。远远望去，屹然独立，如柱倚天。汉武帝封此为南岳，道家称此为司命峰。晚唐诗人曹松赞颂天柱山“七千七百七十丈，丈丈藤萝势入天”。白居易赞美天柱山“天柱一峰擎日月，洞门千仞锁云雷”，李白也称“待吾还丹成，投迹归此地”。苏东坡更是“平生爱舒州风土，欲居为终老之计”。镜头中的天柱山是一样的，但看镜头的心境不一样，眼光不一样。或“撑空云霞断”，或“半岭阴晴隔”，或“山有色而环围”，或“穷幽深而不尽”。巍峨天柱山，由此生万千梦幻色彩。李白言：“奇峰出奇云，秀木含秀气。”王安石言：“一溪清泻百山重，风雨能留邴曼容。后夜肯思幽兴极，明月孤影伴寒松。”黄庭坚言：“畏畏佳佳石谷水，鼓鼓隆隆山木风。炉香四百六十载，开山者谁梁宝公。”相对天柱峰，永远底气不足，缺失的是它那铮铮凛凛的阳刚之气。泛舟花亭湖，始终无法宁静，缺失的是它那海纳百川的包容之心。讶异皖河两岸，怎么就有鹞落坪秋色的火红，司空山明月的深蓝？怎么就有明堂山的隽秀婀娜，炼丹湖的幽明幻变？怎么就有浮山白云的灵动，小孤奇峰的俊奇？层峦叠嶂是山，雄峻大气是山，积翠拥黛还是山。潺潺清溪是水，九曲八环是水，烟波浩渺还是水。山因水雄，水因山秀。无怪乎一代大师邓石如，以“家在龙山凤水”而怡然自得！山水宜居，居安而庆！（来源：安庆老城闲人）
池州秋天快收尾了 快来打卡吧,没有看过池州的秋天，你不会知道它的无须粉黛，秋韵浓浓，白墙瓦黛在秋意中，如同一幅幅出自大家的水墨画，池州的秋天犹如上帝打翻了调色盘，浓妆淡抹总相宜，捕捉不够太美的姿态，连摄影师都为之疯狂起来！九华山的秋天，属于一片枫林、一座寺庙。红了的枫叶不再掩映在翠绿的松柏中，远远望去，恰似一场焰火的集会。近观这片焰火，与黄墙黑瓦交织一片，禅意绵绵。走过了春的明媚，夏的蓬勃，还没来得及多想，转身便与秋不期而遇；正是在这秋冬接替的季节里，才有最惊艳的风景。石台七井山的秋，是摄影师镜头下的拍不完的色彩。童话般的完美，幻化成人们想象中理想的世外桃源。藏在皖南幽深处的原始村落，已经有六百多年的历史了，村落处于青山绿水环抱之间，至今还保留着一如初见时的纯粹的美丽。“万山红遍，层林尽染”，“枫叶如丹照嫩寒” ，“一重山，两重山，山远天高烟水寒，相思枫叶丹” ，“枫叶落，荻花干，醉宿渔舟不觉寒。” 古诗词中的红枫美在意境，摄影师饶颐镜头下的红枫美得更加直观。卧于池州东南面，被喻为“安徽的西湖”，一年四季，都有着惊人的美，尤其秋冬的平天湖，恬静浓妆淡抹总相宜。一步一美景，景景相呼应。三台山，古杏花村十二景“三台夕照”和“桑柘丹枫”的所在。秋冬季节的三台山，呈现一种静谧之美。叱咤嫣红，在城市的车流中，静静地展示自己的美，有花海，有丛林，有……北纬30度上的美景，清清的湖水，裸露的滩涂，弯弯的河，还有一群西伯利亚的鹤在翩翩起舞。池州，在深秋开始变得沉稳，告别了烟雨蒙蒙的春夏秋，现在，也开始步调一致的进入了冬天，但美景并不随气温寒冷，而有丝毫减弱，莫等莫思，美景在身边，赶紧行动起来吧！（来源：池州旅游）
收集九华山最全色彩搭配 送给你,如果问你 你最爱的颜色是什么？是天空蓝，还是枫叶红？我会说，我最爱的色彩不只一种，在九华山，颜色组合是无止境的。不论是浩渺波澜的云海，还是灿烂绚丽的晚霞，九华山都有无数的灵感等你去发现。当苍山的翠绿遇上纯净透彻的云海，彷佛空气的清香沁人心脾，无时无刻不让人感到身心安然。当秋风渐起，当白雪皑皑，九华山没有灯火阑珊的辉煌，只会给予人们最美好的景色。岁月在这里更换着老旧的容颜，任花开花落，九华山依旧不改初时的模样，散发着自然的魅力。如果 你也爱这自然的色彩 爱这纯净的美景。那么，来九华山寻找灵感吧！（来源：九华旅游603199）
这个极边古镇 历史上为什么建这么多洗衣亭,以往旅行总是一个晚上换一个地方，每天要整理行囊，洗的衣服不干就得装箱，这次到可以住两个晚上，静下心来可以安排一次早起，一次夜游，不免有些欣喜。一早赶到古镇主大门的小河边，太阳从山背上缓慢出来，晨光却早已抹亮河岸前广阔的稻田，收割后的田畈显得金灿灿。来自镇子上游地下涌泉形成的龙潭，澄澈的柔水傍着小镇村落流淌，将民居与农田隔开，就像一条护城河。四周古老的火山环绕这一片广袤的田野，静谧而安详。游子有词云：“家乡好，最好头。”顺着“噼啪”的捣衣声，已有更早的村民开始来到河边，回忆起来，这是最大的一座洗衣亭了，六、七条石板架在亭子延伸出的石墩上，占了的一大半，既能蹲，又能做洗衣板，而下面的水流畅通无阻。另一条石板驾到河对岸，可以直接通到稻田里。如果从镇子的上游龙潭开始沿着小河和荷塘走，每隔一段会有一个古朴典雅的小亭子，在水边矗立，大约有6、7座之多，建筑风格和布局也各不相同，有大部分将洗衣板搭建在屋檐下的，也有延伸出的，有木头耸立作柱子的，也有砌上石柱或砖墙的。给我开车的司机介绍说：和顺古名叫“阳温墩”，由于小河绕镇而过，后改名“河顺”，取 “士和民顺”之意，在滇西南少数民族聚居地区，是少有的汉族村镇，他们都是人、江南人、中原人的后代。明洪武十五年征战西南金齿、腾越，事平后，因距京城远，边境多战乱，于是设镇守总兵官，沐氏世袭此职，寸、李、尹、刘、贾五姓，作为沐氏部下亦得袭官授田，世代留守边地，开辟军屯和民屯，后居“阳温敦村”。之后，来自湖南的张姓，来自南京的钏姓，杨姓也来到这里，形成了和顺今天的八大姓。由于和顺离才70公里，历史上曾是马帮重镇、古“西南丝绸之路”的必经之地，400多年前，一代一代的和顺男人跟着马帮的驼铃声出国，当地称为“走夷方”。他们大都去做生意谋生活，也有通过远走、、、的，其中不乏成为巨富大贾。男人们下南洋，女人们留在了家乡，春播秋收，洗衣做饭，孝敬父母，抚育儿女，女人为家庭付出了很多，而游子返乡时又会带回许多需要换洗的衣物。“走夷方”的和顺男人既为人子又为人夫、为人父，总有许多放不下的牵挂，为了让家中的女人在洗衣时不被风吹日晒，给一点慰藉和呵护，便一个人或三两相邀凑份，备料请工，在河上铺石修亭，天长日久，这一路小河上便有了大大小小的洗衣亭。这些风格各异的洗衣亭也成了公共场所，洗衣洗菜的女人们也可以聚在这里聊天交流，消遣空房的寂寥。过年过节的时候，离乡背井的男人总要回来，洗衣亭就成了女人守望亲人的地方。看这些洗衣亭总是建在村口，视野开阔，也许只有久远出门而又牵挂着故乡的人，才有如此精心的心思。和顺陷河上游的龙潭方圆数十亩，碧波荡漾，水体澄澈，潭周边以精美石栏装饰，潭中石亭翼然，潭畔古木苍天。龙潭洗衣亭上的对联是游子内心最好的写照：梦魂五夜萦乡绪，风雨一亭动杵声。六百余年来，这里的人们深受儒家思想的影响，遵循传统，崇尚知识，注重读书，传承着古老的中原汉文化的精髓，培育出了许多文化名人、富商大贾。保留下了大量文化艺术价值很高的古民居建筑群，许多艺术风格也体现在洗衣亭的建筑中。这个洗衣亭较为古旧，木头石墩为柱子，屋顶为歇山顶，正脊、垂脊、戗脊上均有透空花脊作装饰，瓦片虽因时光浸洗斑驳不堪，却仍旧能看出整个亭子造型的精致，应属于清代前期的建筑。现在的和顺自然家家户户都有洗衣机了，但是年长的老人们还是比较喜欢来到洗衣亭洗衣，寻找过往的记忆，男人是她们的蓝天，碧水是她们的柔情，觉得只有亲手洗过的衣物才有带着家乡的味道。一座座洗衣亭，就像男人结实的臂膀，虽然不能为女人们遮蔽多少风雨，却也让她们感受到了温暖和依靠，这是远走他乡的和顺男人对自己女人最朴素的感恩。和顺交通：县城至和顺4公里，有面包车直达，也可以打的10元。门票80元/人（包括、、、文昌宫、民居博物馆、）。
冬日里的杏花村 只一眼便将它放在了心上,初冬里的杏花村，唯美兮！一样的日出日落，无数个静默的日子似曾相识地重复。经过一个夏天的炙烤，一季秋阳的沐浴，荷花完成了与季节最美的邂逅之后，岁月已经走上了荷的眉端额际，深烙着岁月的皱纹，并在岁月中慢慢失色。谁说秋冬就一定是个色彩黯淡的季节，冬日里的杏花村依旧斑斓，虽不像春夏季节那般明快浓烈的色彩，但却把静谧的冬景，点缀的不枯燥，刚刚好。一池残荷，颓枝败叶，余辉残蓬，不堕污泥，清风透骨，生命尽头呈现的是美和精致，与哀伤无关。残荷是生命的记录，如诗如画。冬日暖阳下的杏花村，镀上了一层迷人的金黄。只一眼，便叫你暖在了心里。（来源：池州旅游）
广西的好空气等着你来吸氧,冬日天气雾蒙蒙，小伙伴们分分钟想要逃离，小编忍不住要开始卖安利：看我大不少地方，常年空气都好得不得了，秒秒钟让你顷刻忘掉雾天的烦恼，那就到的好空气里来吸氧吧~[]从县城出发，沿着蜿蜒曲回的盘阳河，可以到达长寿村。盘阳河发源于境内，全长145公里，在县境内流程有82公里，它像一条绿色的玉带，哺育着沿河两岸的无数山峦和村寨。盘阳河四进四出地下溶洞，以洁净之水为沿河两岸的居民带来了延年益寿的生命之源。这一带空气中负氧离子的含量均在每立方米30000个左右，是的100―750倍。走进盘阳河谷，便能切身体会到寿乡神奇大自然中那风秀、谷幽、气香、水甘的山水特色。在盘阳河谷，如有幸识得这一带村民自然天成的裸浴风情，您会更加深切地感受到寿乡盘阳河的神秘与妩媚。盘阳河畔的裸浴，其实是反朴归真的一种古风，也是几千年来这里人们长寿的秘诀。盘阳河水清澈见底，因四进四出地下溶洞而被矿化，于是水中含有十分丰富的矿物质，河水一般恒温于十七八度左右，不冷不热。长期裸浴，不仅可使肌肤滑嫩，而且可以驱疾健身。哪怕走遍五洲四海，游尽人间岩溶乳洞，仍然不能不为巴马水晶宫击掌叫绝。无边的雪绒石毛、似海的卷曲晶针，汇成了世上唯一的非重力水成因晶花王国，晶莹剔透、震撼人心。走进水晶宫你恍如置身一个玉砌般的童话世界，地上发育着鲜活、透明蘑菇状晶体，空中垂悬着白嫩、纤细、蜷曲且神态各异的水晶球、水晶花、水晶草，而那些洁白无瑕通体透亮的玉柱、玉笋则在天地间毫无顾忌地疯长着，所有一切在冷光源灯光作用下扩张着惊人魂魄、动人心脾的渗透力。看完水晶宫，自然要去和百魔洞。百鸟岩位于巴马瑶族自治县甲篆乡烈屯西北面的漠斋山下，因洞内燕子栖集，蝙蝠掠飞，还有岩燕、岩鹰等禽类栖息，据说每日朝霞初升夕阳西斜，成千上万的岩燕飞出洞口贴水逐戏，蔚为壮观，故称百鸟岩，是盘阳河最后一处千米游程的伏流暗河出水口。一般城市，每立方厘米空气中小粒径负离子含量是1000至2000个左右。而巴马长寿乡含量则达2000个至5000个，几个长寿村则高达3万个，而天坑内又为最高，被称为“天然氧吧”。[明仕德天]位于广西崇左市县硕龙镇的德天村，是仅次于尼亚加拉大瀑布的世界第二大跨国瀑布，山间的空气负氧离子含量极高，确实是清肺的最佳场所。德天瀑布的水量充足，周围植被茂盛，可谓绿意葱茏。瀑布周边的风景也十分漂亮，群山环绕，绿树环抱，还能到中越界碑处参观，体验一下脚一跨就能出国门的感觉。站在瀑布之下，水气蒸腾，直冲云汉，其滚滚洪流，折而复聚，连冲三关。仰望瀑顶，群峰浮动，巨瀑似海倾，水花飞溅，犹如万斛明珠。蓝天、白云、青山、碧水、绿树、红花构成了一副美丽的画卷。德天瀑布雄奇瑰丽，变幻多姿，碧水长流，永不涸歇，无论春夏秋冬，阴晴雨雾，均各具情态。明仕田园，堪称小桂林，方圆20公里山清水秀，山环水绕，翠竹绕岸，农舍点缀，独木桥横，稻穗摇曳，风光俊朗清逸，充满南国田园气息。奇特的喀斯特岩溶地貌，造就了明仕田园风光迤逦，大自然的鬼斧神工在这里体现得漓淋尽致。遇上浓雾的天气，说是一点也不为过，或者说是真正的。《酒是故乡醇》、《牛郎织女》、《天涯侠医》、《春蚕织梦》、《本草药王》等多部优秀影视作品先后在这里拍摄。这里有明镜似的小河，划入天际的扁舟，绿油油的稻田，乡土风味十足的水车、水渠与独木桥。泛舟河上，感受竹丛山峰蓝天白云倒影如镜，再衬以小桥流水，百鸟啼鸣，以及村舍中的鸡鸣狗吠，是一处难求的令人迷醉的田园风光。[大容山]“岭南美玉、胜景如林”说的便是玉林的美景。江南四大名楼之一的真武阁、四大名关之一的鬼门关，大容山森林公园、都峤山……有了这些，玉林空气的清新度，还用解释吗？谷中的小溪均是高山上的天然水垂落而成的。清澈透明的泉水顺着逶迤的峡谷流淌，遇到奇石怪树阻挡，便形成了形状各异的小瀑布。九瀑谷的瀑布峰回路转，跌宕多变，水质极佳，叮叮咚咚打在深谷里，宛如一首首优雅的歌曲。大容山不仅有广西常见的丹霞地貌特有云雾缭绕、古树参天的景观，还有世界上罕见的高山草甸、高山湖泊、高山飞瀑等欧式美景。不用出国，也能享受欧式的湖光山色，呼吸最新鲜的空气。在山顶眺望，峰峦层叠，近的明亮，远的连绵，身心确是豁然开朗。沉辽阔的天然植被，给大榕山又添多了几分原始森林的特色。在山上有着这么一片平坦，实属珍贵。被称作天湖，不虚此名，躺在这草地上看天看云，会感觉更近吗？
歙县阳产 一个藏在皖南大山里的古村落,“青砖小瓦马头墙，回廊挂落花格窗”，一句话详尽的描绘出皖南建筑的特色，殊不知，在深藏皖南的大山里，还有片红棕色的土楼，在茫茫的白墙黛瓦中崭露头角！这个地方，叫阳产！阳产土楼群坐落在省千岛湖黄金旅游线上，交通十分便利，距离镇所在地深渡6公里处。因临近新安江，空气湿润，山水养人。阳产村是一个悠久的古村落，为郑姓居地，据传郑公守猎到阳产，其随行猎犬卧于阳产山凹不愿返回，郑公见其四面环山，山泉清澈，经审视，认为是块风水宝地，决心迁移定居阳产。阳产村是一个依山而建的山寨，房子以土楼为主，土楼群是阳产村最大的特色，一座座，一排排，密密麻麻，一幢接一幢。均以青石砌磅为地基，再建土楼，土楼与土楼之间有石板或石板台阶或青石铺地。远望群山如黛，阳产地势高起，这里百分之九十都是土墙屋，看上去一片温暖的红棕色，给人的第一感觉就是原始，古朴，静默。无论是每一座单体土楼，还是整个村落的土楼群，它都有一种乡土的美感，体现出独特的书画的意境美、雄浑的气势美。这里植被茂密，水源丰富，民风淳朴，土楼群依山就势、布局错落有致，体现了一种人与自然融为一体的美感，具有浓郁的山区民居建筑的特色，构成一幅古朴壮美的画卷。在阳产村附近，有个叫金竹岭的地方，这里的黄山贡菊成片的盛开着！每到11月，菊花开得正盛，在这采摘菊花的农时，我们可以跟上山摘花的村民，一起去山顶上的花田。山道石板路，弯弯绕花田。花田开白花，清香幽可闻。山坡铺花毯，图案耕耘成。小小的白菊，原称徽菊，是一味中药材，可以却病养颜等作用，与杭白菊、滁菊、亳菊并称四大名菊。徽菊在明代成为了贡品，入了皇帝口，徽菊则改贡菊。来到徽州，来到，要说特色美味，不得不说姬公尖的灯笼柿。这个地方，可能没有阳产土楼的建筑之美，可能没有金竹岭菊花的清幽花海，但是这里有灯笼柿独特的美味！上丰乡花果山腹地有个叫“姬公尖”的地方，秋末冬初时节，漫山遍野柿子缀挂枝头，如一串串红的“灯笼”，从高低错落的马头墙边悄悄探出了头来，散发着醉人的甜香。在海拔700米的高山之颠，姬公尖盛产梅花、茶叶、柿子和柑橘！带霜后，晒柿饼的景象遍布姬公尖的一角一落！姬公尖的柿子堪称“柿子一绝”！咬上一口，金黄的汁液流进嘴里，柔软的纤维迅速缠绕着味蕾，甜美的气息在舌尖跳跃，酣畅淋漓顿时大呼过瘾，回味无穷。皖南似乎是格外被上帝偏爱，不仅有磅礴大气的山水之景，还有温婉细致的小桥流水，更有阳产土楼的别致、金竹岭贡菊的清幽，以及姬公尖灯笼柿的香甜！那么，趁时光正好，一起去皖南看看吧！（来源：周末游）
十二月的雨山湖鹃岛有惊喜 错过等明年,雨山湖是马鞍山的一颗明珠，镶嵌在城市中央，这里树木成荫、碧波荡漾。雨山湖的西北角有一处鹃岛，小岛被湖水环绕，环境清幽。老马鞍山人肯定知道，这儿原本是一片稻田，夏天蛙声一片，秋季四处洋溢着稻香。六十年代初，上海设计院对这块低洼的稻田进行了改造，全市各单位分工，挖土造岛，经过大家的努力，鹃岛就这样形成啦！十二月的马鞍山市区，哪里景色最美丽？毋庸置疑是雨山湖！不需要多么特别的时刻，每天上班下班的路上，或午间休息的时候，你都能看到她的美。最好在有阳光的天气里，去雨山湖的鹃岛走走，这里游人不多，可以安静欣赏树叶五彩缤纷的美。不需要多么特别的时刻，每天上班下班的路上，或午间休息的时候，你都能看到她的美。最好在有阳光的天气里，去雨山湖的鹃岛走走，这里游人不多，可以安静欣赏树叶五彩缤纷的美。（来源：马鞍山智慧文旅）
绘不出的屏山慢时光 一见难忘却,黟县有很多古村落，这里就是很多人心中的“故乡”。中国历史文化名村屏山位于黟县城东四千米，这里山清水秀，人杰地灵，村子之所以叫“屏山村”，是因为村北的山形状如同一面屏风，依山面水的屏山村也是一个风水非常好的地方，村子已经有了1100多年的历史。在黟县中，很多村落中的姓氏都不一样，屏山村的姓氏大多为舒姓，这里又因为古建制为黟县九都，所以又被称为“九都舒村”。村中的石板桥链接着两岸，在桥中有很多百姓坐在这里休憩聊天，还有很多来自全国各地的学生在这里写生，桥下的小溪还可以看到妇女们淘洗着衣服。古桥上的彩绘，相传唐朝末年黄巢起义，舒氏作为庐江大族，不堪忍受战乱困扰，举家南迁。当时兵荒马乱，舒氏不知该迁往何处才能安居乐业，后来夜里做梦长须白发老人告之“舒氏南迁，逢长则止。”舒氏到了屏山后，看中九都这块风水宝地，又得知屏山又名长宁里，地名中有“长”字，符合梦中老人的提示，于是便在屏山定居，开始了在这块土地上的繁衍生息。村子的入口处就可以看到吉阳溪九曲十八弯穿村而过，青砖灰瓦的民居和店铺都沿河而建，故乡的田园风光与徽派建筑交相辉映。在屏山村完好的保留着200多栋古民居和三姑庙、御前侍卫贴墙牌坊、长宁湖、葫芦井、小绣楼等名胜古迹。在屏山有一广告语：“无论画家和摄影师如何的描绘，都不如那一座屏山为名。”屏山也是一个人才倍出的地方，来自屏山的演员舒绣文以其精湛的表演天赋，成功地扮演了《一江春水向东流》等影片中的角色，成为人民艺术家，并受到了周恩来总理的接见。清朝诗人余逢辰在游屏山时写下诗句：“青山列画屏，雨余翠欲滴。秋叶更春花，纷披似锦织。”屏风山就像一列四时皆丽的锦屏，衬托着建有无数徽派古民居的屏山村落。在屏山村保留着很多古建筑和祠堂，这其中就以古色古香的“舒光裕堂”为代表。舒光裕堂是我国皖南地区规模最大的明代宗族祠堂。舒光裕堂。舒氏宗祠中有一副高大的楹联：“源溯庐江，舒国舒城寻旧派；秀钟徽岭，长龄长演尽同根。”在中国封建社会，由科举入仕是进入上层社会的一条途径。在这块风水宝地的蕴育下，黟县屏山由科举而中进士的自宋至清有舒介夫、舒升中、舒彦中、舒夷中、舒宾王、舒擢、舒叔宝、舒荣都、舒崇功、舒斯笏等人，至于中举人的更多。而且还出了不少文化英才。在庆余堂中还摆放了一些村民生活的习俗用品。屏山的游客相比西递和宏村来说并不是很多，远离了都市的喧嚣，走在这里的小巷之中，也让人有了一种时空穿梭的感觉。如果你觉得西递宏村的游人如织、商贾云集太过喧嚣、令人厌倦的话，你到是可以来屏山悠哉悠哉地消磨一个下午，体味一下真正的“小桥流水、田园人家”的悠闲自得。在屏山也可以看到著名的徽派三雕：砖雕、石雕和木雕，这些工艺都具有浓郁的民间色彩。徽派古建筑也以砖木石为主要原料和木建筑为主。春季，远眺屏村，一栋栋高低错落有致的徽派民居在金黄色的油菜花掩映下层次分明，清新夺目的就在眼前。冬天的屏山，银装素裹，白雪皑皑，更是一副清静的徽州水墨图。（来源：黟县徽黄旅游集团）
