一张门票，带你看尽地球上的珍禽异兽,珍禽异兽，动物王国：深圳野生动物园摄影/文字：TIM生命过客记得数年前，飞越大半个地球，跟随一艘法籍邮轮远航南极，在那里和各种企鹅海豹鲸鱼亲密接触，回来后到处跟人分享极地的动物和风光，足足有半年如同打了鸡血一样，兴奋难抑。地球上的生物动物有成千上万种，在热带、寒带、亚热带、高山草原湖泊海洋，各自千奇百怪地生长，常人想要认识这些地球生物，就得千里迢迢花钱花时间去“拜访”，还得拼人品看运气：比如许多动物有冬眠习惯，您去的时间错了，那可见不着。如今好了，深圳野生动物园集齐了各种来自世界各地的珍禽异兽，号称中国第一家放养式野生动物园，你只要买张门票，就可以一睹万般卖萌的企鹅海豹和各种飞禽走兽，搞不好还能一亲芳泽，合影留念。1、湿地园这一大片湿地，曲水婉转，小桥流水连接水岸，绿树掩映，草木繁茂，鲜花点缀在各个角落。来自中美洲巴哈马的火烈鸟，就在这里闲庭信步。我之前看过的加勒比海的火烈鸟图片，上万只群居的长颈长腿红色大鸟，在蔓延无边的海滩上红潮一样地涌动，那场面极为壮观，过目难忘。火烈鸟身高有近一米多，是发现于3000万年前的远古动物，堪称是动物界的活化石了。这古董级的大鸟不仅源远流长，还长寿，据报道，澳大利亚阿德莱德有只火烈鸟曾经活到了83岁，远胜地球上众多动物和大部分人类。今年的8月24日，媒体还报道了深圳野生动物园孵化了一只火烈鸟宝宝，这只初生小红鸟被称做深圳“土著”，算是火烈鸟移民深圳的“鸟二代”了。湿地的河汊里，还生活着张开大嘴如同漏斗的鹈鹕，在河心的几处小岛上，分别生活着白颊长臂猿和川金丝猴，它们在这些仿生态的小岛上自在逍遥。2、小岛“居民”在天鹅湖的小岛上，生活着马达加斯加环尾狐猴、黑帽悬猴，我们走进岛上，几只尾巴带着环节斑纹面似狐狸的家伙飞奔出来，或站或坐，蹲在我们面前，伸手索要吃的，饲养员拿出香蕉，掰成一小段递给它们，狐猴们飞快地接过去往嘴里送，然后继续人立着眼巴巴地看着我们，那个神态像极了贪吃的孩子，憨萌可爱。黑帽悬猴长着一头平头黑毛，乍一看像戴了一顶黑色的帽子，在岛上木屋和索道之间，飞快地来回跳跃行走，个子小巧的黑帽悬猴们，最大的本领是利用自己长而卷曲的尾巴，勾住树枝倒挂，可以在森林里飞快自如地移动。3、“大明星”红毛猩猩我们见到红毛猩猩“毛毛”的时候，它正单手单脚地把自己挂在天花板上的绳子上，多出来的另一只手和脚，就在空中晃荡。饲养员说，毛毛才5岁，还是个“少女”呢，却已经是动物园里的明星了！因为它性格温顺，喜欢和人亲近，爱和人拥抱。红毛猩猩也被称做人猿，估计就是“人猿泰山”的原型，主要生活在印度尼西亚的苏门答腊岛和婆罗洲，据考证与人类基因相似度高达96.4%。这不，毛毛马上就和同行的摄影师洋光摄客手脚紧握，四目相对，那深情款款的神态，让大家惊呼，这是现实版的“人猿情未了”啊！与热情又通人性的毛毛相比，旁边的两爬馆里，那些盘踞成一团的蛇、发呆不动的蜥蜴，就显出了冷血动物的高冷特质了，它们基本都是独居，生活环境各具特色，灯光、水、绿植、黄沙等点缀其中，按照它们的不同生活习性，各成生态系统，颇具观赏价值。4、野象谷大象在动物园里的表演，是最受孩子们欢迎的项目之一，它们摇摆着庞大笨重的身体，扬起灵巧的长鼻子，喷水，取食，摇呼啦圈，跳起踢踏舞步，坐立作揖，憨态可掬，赢来了小朋友们的一片欢呼声。长颈鹿也很乐于和人们互动，伸着长脖子，越过高高的围栏，来吃孩子们手里的树叶，长颈鹿扑闪着毛茸茸水汪汪的眼睛，透着纯朴和善良，满满的写着“人畜无害”四个字，难怪这么讨孩子们喜欢。往坡下走，一口不大部小的池塘里，泡着“不讲卫生”的河马两口子。我们刚站定，就看到一只河马正在“自由飞翔”，边拉便便边用尾巴飞快地拨弄，将粪便拨到另一头河马的身上，看到饲养员手里的食物，两头河马也顾不着形象，就驮着一身的大便，向我们稳稳的走来。在饲养员的美味面前，河马咧开了大嘴，露出一口参差不齐的牙齿。5、猛兽谷猛兽谷的门口有个虎跳峡，几只华南虎懒洋洋地或躺或坐，直到饲养员用长杆吊了一块生肉出来，才站起来，一个虎跃扑上去咬住，老虎叼着肉掉到了水里，溅起一堆水花。而山坡上的高高柱子上挂的肉，却无虎问津，是因为老虎不会爬树吗？还是此番无缘得见它们施展爬树技能？猛兽谷的大铁门外两边，写着“明知山有虎，偏向虎山行”，我们坐上了大铁笼子车厢，开始虎山行。感觉山野里到处溜达的老虎狮子、狮虎兽们，才是自由自在的游客，看着我们这几个被关在笼子里的“动物”，估计这些山大王心里都窃喜不已吧？我们拿着特制的铁叉子叉起一块肉，刚伸出铁笼外，瞬间眼前一暗，马上有老虎扑了上来吃掉，大家被腥气和老虎唾沫飞溅一脸，引起胆小伙伴的惊叫连连。6、海洋天地和百兽盛会海洋天地里的海狮、海豚表演，对于去过香港海洋公园的人来说，不算什么新鲜事，但是对许多小朋友，看海狮顶球、凌波微步、海豚唱歌，那可是超级好看呢。我们等表演完，跑去和海狮海豚拥抱合影，又弄了一脸海狮口水，不过也满足了一把突然爆发的童心。百兽盛会大型实景马戏特技表演，我们居然看了两次，下午冒着深圳的暑热天气看了一回，晚上又来看了升级版：先是动物巡游，大象、猴子、鸵鸟等动物们集体亮相，黑熊在高空骑单车，赛马特技表演，还有非洲黑人的舞蹈杂耍。最后上场的是汽车特技，高速漂移和高速停车，两位外籍摩托车手的高空翻滚，惊险刺激，非常出彩，扣人心弦。深圳野生动物园里，还有国宝“熊猫”、斑马、白犀牛、麦哲伦企鹅、大食蚁兽、羊驼（草泥马）、袋鼠等等我们平常难见的动物们。此外，动物科普馆、自然教育中心、自闭症儿童康复基地，集各种功能于一身，可谓是家长们带着孩子们来寓教于乐、增长知识、亲近自然了解动物的科普园地。
大理沙溪全攻略 详述十个必游地点,沙溪，位于中国云南剑川县西南部，在丽江和大理之间。距离大理古城120多公里，距离丽江古城有90多公里。可能由于特殊的地理位置，也许由于交通不便，使得沙溪很好地保存了当地的民风样貌。由于交通比较周折，快闪型游客一般会错过沙溪的安静古朴，但这也是沙溪至今暂未变成第二个丽江的原因。2001年10月，寺登街以“茶马古道上唯一幸存的古集市”之名与长城等古建筑一起，列入世界纪念性建筑保护基金会“值得关注的101个世界濒危建筑遗产”。这个集市仍旧延续到今天，每个周五都可以见到村里赶集的人们。你甚至可以去到欧阳大宅，听欧阳奶奶唠嗑欧阳家的兴衰，沙溪古镇的变迁。。如果对南诏国充满好奇，可以花上半天到这里游玩。由于远离城市，小镇本身开发程度还不算高，夜晚十点小镇就沉睡下来，少了人造灯光的影响，沙溪夜晚的星空，银河，可是绝佳的。摄影爱好者不能错过。沙溪，小镇很小，群山环绕，晚上十点就没灯了，被星光环抱，中华田园犬，陪着追星人，不吵嚷。沙溪这个地方不适合游景点，适合不期而遇地撞见，轻轻地抚摸着墙上的时光印迹，悠闲而散漫地度过时光。玉津桥，位于黑惠江上，桥面由大石板铺就，是当年马帮进出沙溪的一个重要要道。而现在的玉津经过百年历史仍旧静静地立在这里，桥头的土地公公土地婆婆像，眉眼都已经被风霜打得模糊，香火也把四周熏得有点黑黑的，但整个就是生活的感觉。当年马帮踏过的玉津桥，如今倒成了一个观星绝佳地点。早晨，人们喜欢在玉津桥上看黑惠江缓缓升起的雾气。位于四方街的古戏台，清朝年间建。建筑一共有三层，第二层戏台子，下面商铺，最上面供奉着魁星。古戏台尽管已经被作为文物保护起来，但是每年都在使用。戏台在兴教寺对面，古戏台的戏是给神仙看的，参观完兴教寺，请工作人员打开戏台旁边的小门后才能继续参观茶马古道陈列馆。有时候古戏台上会有表演，当地老人，穿着上百年的戏服稀稀拉拉地唱，特别有意思，也特别符合沙溪这个地方的散漫气质。唱曲节奏特别特别慢，后面有人提词，基本上提词的人说一句，唱戏的人唱一次。大家有机会可以亲身体验一下。傍晚当地的小孩会和游客的小孩一起在树下踢毽子，感觉很和谐。位于四方街西面，正对古戏台，始建于永乐年间。最里面大殿外墙上部的16幅佛教题材壁画，是寺内最重要的文物，但保护欠佳已经很斑驳，第二进院里有临摹壁画展。第一进院里是大理白族密宗佛教阿吒力的展览，对民间宗教有兴趣的可以仔细看。门票：与展览馆联票20元；开放时间8：00-17：30沙溪寺登街一直是沟通东南亚、南亚、南诏和吐蕃的咽喉要道。现在的寺登街只剩下了兴教寺、古戏台、玉津桥和青石铺成的四方街等遗迹，还有以欧阳大院为代表的30多家老宅院。 茶马古道上唯一幸存的古集市。集市品种包罗万象，有木器，古董，花卉，家畜，禽类，蔬菜，百货……寺登街还有以欧阳大院为代表的30多家老宅院。欧阳大院大门上的木刻很精美，红砂岩门檐上的雕花几乎没有衣服是重复的。这是沙溪保存最完好的马锅头宅院，如果有时间还可以在欧阳大院里听老奶奶唠嗑欧阳家的那些事。门票：10元此山在沙溪古镇北，驾车前往山门约18公里，以南诏大理国的石窟造像闻名，费孝通曾赞“北有敦煌壁画，南有剑川石窟”。尽管石宝山的石窟规模很小，可以与敦煌相比的是其年代和历史价值，但一些雕刻也颇为精美。门票：50元，包车司机不参观石窟不用买票。曲径通幽，风景美丽，沿途有始建于南诏时期的石窟，距今已经有1000多年了，丹霞地貌，龟背石比比皆是。基本上，一年四季都是可以去大理游玩的，下表为云南大理历史温度及降雨。像大理所有地方一样，漫山遍野的春花。大理雨季，刚逢暑假，来大理避暑也是一个好选择。但是如果觉得游人略多，可以选择去大理古城周边城市，沙溪也是个很好的选择。还有夏日观星。秋天的沙溪，群山环绕，颜色变幻莫测。人相对较少，可以安静地感受时光流过沙溪的痕迹。冬天的沙溪星空也是可以看到银河的哦！沙溪古镇附近有不少传统村落可以参观，下面简略介绍一下。沙溪周边古时候有4处哨卡，主要用作收盐税及保护马帮旅行。喜欢人文的旅行者，可以去探访西卡马坪关。沙溪马坪关，一个古老的白族村落，据说大理国一阳指段誉的叔叔，得罪了段誉家老爹段皇爷被发配到马坪关收盐税，而繁衍生息下来，这里只有40多户人家，绝大部分姓段，这里有古戏台，古廊桥，魁楼，盐马古道……沙溪盐马古道经马坪关到达沙溪古镇，再由沙溪古镇进入茶马古道，向北进入西藏。南来北往的客商才有了古戏台和茶马古道上的古集市。沙溪往东过玉津桥，约3小时徒步可以到达华丛山，那里是高原草甸，有两个彝族村落，村里的生活条件比较艰苦，但也有客栈。沙溪华丛山上的彝族孩子，虽然贫困一点，孩子的幸福指数还是很高。在这里你可以看到最美的彝族风情。沙溪往南4公里处，有大理州最大的城隍庙大照壁，城隍庙在“文革“期间被改造成了粮仓，里面保留着不少当时的宣传画。瑞士发展合作署的修复计划未果，现在这里仍是一个仓库。虽然没有神像，这里的香火仍未断，大门上贴满附近村民感谢城隍老爷赐姻缘的对联。城隍庙约2公里远可以到达白龙潭，白龙潭的泉水出口，虽然不大，但被古树环绕，非常幽静，春暖花开时，当地人喜欢结伴来这里野餐。沙溪古镇让我们感受到古朴的民风，但是它沉淀的历史价值却让我们的内心泛起涟漪，如果你想赶上这股历史的韵味，那就出发吧！前面我也写过很多的关于旅行的方式，旅游攻略，穷游等等很多的文章，大家可以关注我 @旅行攻略咖，说不定我的文章能给你们最好的答案和帮助，也可以微博私信博主。我们一直行走在路上，期待你的加入。更多云南旅行线路攻略请私信博主@
美丽的伊春带岭大箐山 你约了吗？,作为伊春人，曾无数次的去带岭大箐山一睹它的风采，尤其在冬季。几天前，得知带岭区委、区政府为了加大旅游宣传力度，扩大带岭旅游资源的对外知名度，将举办首届带岭四季风光摄影大赛。云雾中的大箐山油画般通往大箐山山顶的山路大箐山林中秋色大箐山植被
千年之约~古镇黄姚,不知道是第几次到黄姚古镇了，也许是家乡的小镇吧，我走过中国许多古镇，维有黄姚是来过多次的。黄姚坐落于中国广西壮族自治区贺州市昭平县东北部的一个四面环山的小盘地。这里山青水秀，是一个充满诗意的地方，这样一座淡泊的千年古镇，经历了岁月的洗刷和沉积，默默的吸引着天南海北的游客。以前宣传的不够使得黄姚的“开发”相比中国其它古镇稍显逊色，正是如此反而使这里少了那么多的市侩。 这里面住着百岁老人，因为这里的山多地也多，每个人都是自己吃自己种的菜，无农药，空气也清新，水也好，是一个安享晚年的好地方。现在黄姚镇被评为“长寿镇，昭平评为“长寿县”，贺州评为“长寿市”，来过这里的游客都由衷赞叹：这里真是一个世外桃源啊！曾有人这样形容：“黄姚古镇如同一本千年的诗集，被人遗忘在图书馆僻静的书架上，当人们不经意地走过，翻开这美丽的篇章，古朴而优雅的格调便立即征服了人心”。古镇里的楼房街道都是很古老的，一看就知道是有上千年的历史了。楼房全都是用泥砖、青砖、木头和青瓦盖的。地上的道路是石板，是坑坑洼洼的，经过多少人的踩踏才变平，雨水让青石板变得象镜子般光亮。这里还有本地特产的食品。如豆腐酿、豆豉、辣椒酱、豆豉粉……其中最出名的就是豆豉，这里的人们家家户户都有自己的豆豉，谭姐的小店以经成了品牌。现在黄姚镇被评为“长寿镇”昭平评为“长寿县”贺州评为“长寿市”，来过这里的游客都由衷赞叹：这里真是一个世外桃源啊！现在去黄姚古镇很方便了，高速公路直达黄姚，坐高铁到贺州下车就有到黄姚的班车。古老的小镇欢迎你！
秋色泸沽湖，天堂里的女儿国,詹姆斯希尔顿在小说《消失的地平线》里这样写道，“这里从未被污染，仍然保持着天堂般的纯洁与爱，在这个离天空最近的地方，有一个隐匿雪山深处的高山湖泊，至今还保持着母系氏族社会的走婚习俗，它如此虚幻迷离地在人们的现实生活与精神世界之间的地平线上游荡了整整半个多世纪，至今仍散发着诱人的感力，始终是世人内心深处向往的一片“世外桃源”。”也许，文字可能会言过其实，但小说中所描述的高山湖泊却真实地存在，它就是位于云南与四川交界的泸湖湖。 其实，最早知道泸沽湖也是源于《消失的地平线》一书，小说中提到的香格里拉地区让整个西方甚至世界都为之疯狂，而书中最吸引我的却是这个隐密在大山深处，被誉为“东方女儿国”的泸沽湖。 抵达泸沽湖已是下午，从四川境内直奔云南里格，站在高地，当所有的这一切都真实地展现在眼前，不敢相信现实中的泸沽湖美得比文字来得更加让人着迷。 还未到里格，师傅把车停在了山公路边的一处观景台，从这里可以俯看泸沽湖最精华的一段，里格半岛。虽然以前到过，但看到它的那一刻，心灵还是被深深地震撼了，也突然明白，很多时候当遇真正触动心灵的美的时候，语言和文字都是贫乏的，因为你会觉得所有的美好都不够用来形容你眼前的这一切。如果我会唱歌，我想我会唱起齐豫的那首：高山上的湖水，是躺在地球表面的一滴眼泪。。。。。。 这个季节的泸湖是淡季，没有那么多的游人。住在湖边，早上推开窗你就可以看到一个最真实的泸沽湖。有时在想，其实淡季的泸沽湖也很美，为什么人们都要在夏天前往这里去看人流？ 看到这样的画面，真的有一种说不出的感觉，可能这就是此次泸沽湖之行真正打动我的地方：平静、简单 如果可以，我愿在这里呆上十天半个月，无关世事，无关城市，只愿做一个泸沽湖畔的闲人。终于明白著名的美国探险家、植物学家洛克可以在这里终老，原来一切都在画里。 洛克自1922年来到云南，在云南待了27年，而在这27年里有20年都是待在泸沽湖上一个四面环水的小岛上，洛克对这个泸沽湖的小岛情感甚深，以至在他病倒弥留之际（1962年）还写信给自己一位挚友说，“与其死在夏威夷的病床上，我更愿意回到泸沽湖的鲜花丛中。”可见泸沽湖的魅力。 一切都显得那么不真实，可又真实地存在你的眼前。看到这样的景，真的不知道是现实走进了画里，还是画走出了现实。 沉醉在漫天飞舞的鸽群里；如果不是《消失的地平线》，中甸仍旧叫中甸，而不是现在的香格里拉，其实每个人都应该在心中有自己的香格里拉，它代表着一种对人间仙境的向往，对世外桃源的渴望。。。。。。此刻，我沉醉在自己的香格里拉。更多我的实时旅行动向可以关注新浪微博博：@行走的强子
大美巴楚 刀郎歌中唱的喀什葛尔的胡杨到底有多美,任我是三千年的成长人世间中流浪就算我是咯什噶尔的胡杨我也会仔仔细细找寻你几个世纪在生命轮回中找到你…………当年刀郎的一首《喀什葛尔的胡杨》征服了无数歌迷的心，也让人对新疆那壮观的胡杨林越发的向往起来。喀什是南疆非常重要的一个城市。喀什葛尔是本地维吾尔族同胞叫喀什的全称。刀郎的《喀什葛尔的胡杨》所赞美的也就是喀什境内的胡杨。胡杨是长在这戈壁上的树有“一千年长成，长成一千年不死，死了一千年不朽”的传说。巴楚是喀什的一个县，也是在喀什境内距离喀什最远的一个县，路程270公里左右，开车约3小时左右可达。巴楚也是上海对口支援新疆的一个县，在巴楚县城有个标志性的建筑东方明珠，尤其晚上亮灯的时候更漂亮，离县城很远就能看到它，就像海上的灯塔似的，上海的浦东有条世纪大道，这里也有一条世纪大道。红海湾景区，最为吸引人的就是胡杨林了，林区面积超大，又有湖泊的衬托，更加迷人。景区位于距县城12公里的阿纳库勒乡，以丝路古道为金丝线，重现了汉唐丝路风情。红海湾是南疆旅游线路的重要组成部分，融水系景观、大漠胡杨、人文风情，是集湖泊、河流、草原、湿地、戈壁、胡杨林于一体的生态景观区。当走入景区的一刹那，壮美的景色即刻进入眼帘，碧绿茂盛的芦苇与蓝天白云倒映在清澈的水中，蔚蓝的天空中野雁野鸭自由飞翔，令人心旷神怡，神清气爽。美中不足的就是这次来的有点早了，红海的胡杨林才刚刚开始变黄，让人不免有点遗憾。同时能弥补遗憾的就是这两对景区的维吾尔族的帅哥和美女，有了他们的点缀，让这片胡杨林又充满了生机的浪漫。胡杨树，是国家二级濒危保护植物，木垒的胡杨林更是距今6500万年，孤独的树影，默默地守候在中蒙边疆6500万年，见证着多少朝代更替。“生而千年不死，死而千年不倒，倒而千年不朽”胡杨精神为多少人赞颂。
国庆长假您是否和坝上的野狍子有个约会,狍子以傻冠名，人们通常称之为：傻狍子。说它傻是因为它的执着，一条路走到黑。为什么这种品德到了人的身上就成了优点呢？我看其实是人在欺负人家，不然怎么有史以来狍子就是人的盘中餐呢？我们评介一个的地方的生态通常是说：山青水绿、碧野蓝天，其实生态还有个更为重要的标志，那就是野生动物的生存状态。由于狍子生性机警、个性刚强很难饲养，所以目前关于狍子驯养依然是个比较难的问题，起码可以说成功率不高。也许是我和狍子的缘分到了，以前从来没有见过狍子，尤其是野生的。上个月底驱车前往大西北，由于时间没安排好，在深夜里赶路到了祁连山海拔4120米的大冬树垭口，过了垭口不远一只狍子在漆黑的夜里，突然从车灯前一跃而过，惊吓过后变成了惊喜！这次到京北第一天路游玩，我在显摆的时候陪同我的郑老师告诉我，他前几天也在景区里看到了一只狍子。狍子胆小，通常生存在密林深处，冬天则会出现在人迹罕见的坝顶，所以一般人根本见不到。景区的人也非常喜爱狍子，据说去年有只狍子在林子里生了两只狍子，其中一只一直没有站起来，无奈中被它的妈妈遗弃了。职工们抱回来后又是热水又是奶粉好一通的伺候，可惜天不随人愿。这天我们大清早5点起床，在丰宁的京北第一天路的东山上观赏完日出后，回农家院时景区的路上突然出现一只狍子，它悠闲自在的溜达在水泥路面上，当发现我们的车后就有点着急。景区的这一段路临近景区大门，因此两侧都有护网，左边的比较密实，右侧靠近山坡则是象征意义的铁丝网，这道网的意思在于拦君子不拦小人。其实离这一段用不了几十米，至少三面都可以跑掉了。但是这只可爱的狍子就是认准了左侧，上下观察、左右打量。一股劲的使了上去，左突右攻、寸功不见。情急之下一个鹿跳差点挂在了上面，我们把车停在了那里，想让它早点归林。把我急的只想喊：傻狍子，你倒是跑啊？！那只狍子好不容易脱离了网子的羁绊，看到我们也没有任何威胁，几个鹿跳就跑到了小路的对面，依然是一个勇猛的飞跃穿过了稀疏的铁丝网，钻进了野生的白桦林。虽然整个过程不过几分钟，但是我们俩人都激动的快傻掉了。以至于看到它奔向小路对面的时候为它高兴的忘掉了拍摄，因为那里离我们更近。郑老师说景区的人见过狍子的人也不多，都是机缘巧合啊。要吐槽的是佳能7D2在1600感光度下噪点多的吓人，也难怪当初鸟叔不买呢。虽然设置的快门是500分之一，其实再高些更好，这组片可以说是太业余了，您就凑合看吧！国庆长假就要到了，您是否也去试试运气呢？
